{
  "specVersion": "1.0.0",
  "template": {
    "id": "us.irs.f1040sc.2024",
    "title": "Schedule C (Form 1040) — Profit or Loss From Business",
    "taxYear": 2024,
    "revision": "fixture-2024.1",
    "ombNumber": "1545-0074",
    "source": {
      "filename": "schedule-c.pdf",
      "sha256": "2d69ea9eb68f1afabed66b30510237d585619a7e56cc16871bd2aac0e78d729c",
      "pageCount": 1
    },
    "geometry": {
      "unit": "pt",
      "origin": "top-left",
      "pages": [
        {
          "width": 612,
          "height": 792
        }
      ]
    }
  },
  "defaults": {
    "style": {
      "font": "Helvetica",
      "size": 9,
      "color": "#000000",
      "align": "left",
      "vAlign": "middle",
      "padding": {
        "left": 3,
        "right": 4
      },
      "overflow": "error"
    },
    "format": {
      "blankIfZero": true
    }
  },
  "$comment": "One Schedule C is filed per business. The binding selects which one this instance prints, so every '@' reference below is relative to that business and the template is reused unchanged for 'biz-2'.",
  "bind": {
    "root": "$.taxReturn.schedules.scheduleC[?(@.id == 'biz-1')]"
  },
  "entries": [
    {
      "kind": "field",
      "id": "sc.proprietor",
      "label": "Name of proprietor",
      "page": 0,
      "type": "text",
      "rect": [
        36,
        88,
        340,
        16
      ],
      "value": {
        "ref": "$.taxReturn.taxpayer.fullName"
      },
      "style": {
        "overflow": "shrink"
      }
    },
    {
      "kind": "field",
      "id": "sc.ssn",
      "label": "Social security number",
      "page": 0,
      "type": "comb",
      "rect": [
        400,
        88,
        144,
        16
      ],
      "comb": {
        "cells": 9,
        "gaps": {
          "3": 8,
          "5": 8
        }
      },
      "value": {
        "ref": "$.taxReturn.taxpayer.identifiers.ssn",
        "transform": [
          "digitsOnly"
        ]
      },
      "style": {
        "font": "Courier",
        "size": 9,
        "align": "center"
      }
    },
    {
      "kind": "field",
      "id": "sc.principalBusiness",
      "label": "A Principal business or profession",
      "page": 0,
      "type": "text",
      "rect": [
        36,
        122,
        330,
        16
      ],
      "value": {
        "ref": "@.principalBusiness"
      },
      "style": {
        "overflow": "shrink"
      }
    },
    {
      "kind": "field",
      "id": "sc.businessName",
      "label": "C Business name",
      "page": 0,
      "type": "text",
      "rect": [
        36,
        156,
        330,
        16
      ],
      "value": {
        "ref": "@.businessName"
      },
      "style": {
        "overflow": "shrink"
      }
    },
    {
      "kind": "field",
      "id": "sc.ein",
      "label": "D Employer ID number (EIN)",
      "page": 0,
      "type": "comb",
      "rect": [
        400,
        156,
        144,
        16
      ],
      "comb": {
        "cells": 9,
        "gaps": {
          "2": 10
        }
      },
      "value": {
        "ref": "@.identifiers.ein",
        "transform": [
          "digitsOnly"
        ]
      },
      "style": {
        "font": "Courier",
        "size": 9,
        "align": "center"
      }
    },
    {
      "kind": "field",
      "id": "sc.method.cash",
      "label": "F Accounting method — Cash",
      "page": 0,
      "type": "checkbox",
      "rect": [
        130,
        187,
        10,
        10
      ],
      "radioGroup": "accountingMethod",
      "value": {
        "ref": "@.accountingMethod",
        "equals": "CASH"
      },
      "style": {
        "align": "center",
        "size": 8
      }
    },
    {
      "kind": "field",
      "id": "sc.method.accrual",
      "label": "F Accounting method — Accrual",
      "page": 0,
      "type": "checkbox",
      "rect": [
        180,
        187,
        10,
        10
      ],
      "radioGroup": "accountingMethod",
      "value": {
        "ref": "@.accountingMethod",
        "equals": "ACCRUAL"
      },
      "style": {
        "align": "center",
        "size": 8
      }
    },
    {
      "kind": "field",
      "id": "sc.line1",
      "label": "1 Gross receipts or sales",
      "page": 0,
      "type": "currency",
      "rect": [
        462,
        240,
        92,
        14
      ],
      "cents": {
        "rect": [
          556,
          240,
          30,
          14
        ],
        "style": {
          "align": "center"
        }
      },
      "value": {
        "ref": "@.income.grossReceipts"
      },
      "format": {
        "decimals": 2
      },
      "style": {
        "align": "right"
      }
    },
    {
      "kind": "field",
      "id": "sc.line2",
      "label": "2 Returns and allowances",
      "page": 0,
      "type": "currency",
      "rect": [
        462,
        262,
        92,
        14
      ],
      "cents": {
        "rect": [
          556,
          262,
          30,
          14
        ],
        "style": {
          "align": "center"
        }
      },
      "value": {
        "ref": "@.income.returnsAndAllowances"
      },
      "format": {
        "decimals": 2
      },
      "style": {
        "align": "right"
      }
    },
    {
      "kind": "field",
      "id": "sc.line3",
      "label": "3 Subtract line 2 from line 1",
      "page": 0,
      "type": "currency",
      "rect": [
        462,
        284,
        92,
        14
      ],
      "cents": {
        "rect": [
          556,
          284,
          30,
          14
        ],
        "style": {
          "align": "center"
        }
      },
      "value": {
        "ref": "@.income.netReceipts"
      },
      "format": {
        "decimals": 2
      },
      "style": {
        "align": "right"
      }
    },
    {
      "kind": "field",
      "id": "sc.line7",
      "label": "7 Gross income",
      "page": 0,
      "type": "currency",
      "rect": [
        462,
        306,
        92,
        14
      ],
      "cents": {
        "rect": [
          556,
          306,
          30,
          14
        ],
        "style": {
          "align": "center"
        }
      },
      "value": {
        "ref": "@.income.grossIncome"
      },
      "format": {
        "decimals": 2
      },
      "style": {
        "align": "right"
      }
    },
    {
      "kind": "repeat",
      "id": "sc.partII.expenses",
      "label": "Part II — Expenses",
      "page": 0,
      "over": "@.expenses",
      "origin": [
        36,
        360
      ],
      "rowHeight": 18,
      "maxRows": 9,
      "overflow": "continuation",
      "continuation": {
        "statementId": "stmt.scheduleC.expenses",
        "title": "Schedule C, Part II — additional expenses"
      },
      "row": {
        "fields": [
          {
            "kind": "field",
            "id": "category",
            "label": "Category",
            "type": "text",
            "rect": [
              0,
              0,
              300,
              14
            ],
            "value": {
              "ref": "@.category"
            },
            "style": {
              "overflow": "shrink",
              "minSize": 6
            }
          },
          {
            "kind": "field",
            "id": "amount",
            "label": "Amount",
            "type": "currency",
            "rect": [
              426,
              0,
              92,
              14
            ],
            "value": {
              "ref": "@.amount"
            },
            "format": {
              "decimals": 2
            },
            "style": {
              "align": "right"
            }
          }
        ]
      }
    },
    {
      "kind": "field",
      "id": "sc.line28",
      "label": "28 Total expenses",
      "page": 0,
      "type": "currency",
      "rect": [
        462,
        540,
        92,
        14
      ],
      "cents": {
        "rect": [
          556,
          540,
          30,
          14
        ],
        "style": {
          "align": "center"
        }
      },
      "value": {
        "ref": "@.totals.totalExpenses"
      },
      "format": {
        "decimals": 2
      },
      "style": {
        "align": "right"
      }
    },
    {
      "kind": "field",
      "id": "sc.line31",
      "label": "31 Net profit or (loss)",
      "page": 0,
      "type": "currency",
      "rect": [
        462,
        566,
        92,
        14
      ],
      "cents": {
        "rect": [
          556,
          566,
          30,
          14
        ],
        "style": {
          "align": "center"
        }
      },
      "value": {
        "ref": "@.netProfit"
      },
      "format": {
        "decimals": 2,
        "negative": "parentheses"
      },
      "style": {
        "align": "right"
      }
    }
  ]
}
